name,slug,type,state,city,seats,annual_fees,closing_rank_open,nirf_rank,asmi_recommended,course,established_year,hospital_beds,photo,photo_placeholder_color,contact_phone,contact_email,website,address,affiliated_university,opd_daily,bond_years,bond_penalty,hostel_available,asmi_pulse_score,asmi_verdict,description,attached_hospital,nearby_airport,nearby_railway_station,google_location,pg_courses_availability
"GSL Medical College, Rajahmundry",gsl-medical-college-rajahmundry,Private,Andhra Pradesh,Rajahmundry,250,,,,False,MBBS,,,,#6a0dad,,,,,,,,,,,,,,,,,
"Gautam Buddha Chikitsa Mahavidyalaya, Dehradum",gautam-buddha-chikitsa-mahavidyalaya-dehradum,Private,Uttarakhand,Dehradum,150,,,,False,MBBS,,,,#6a0dad,,,,,,,,,,,,,,,,,
"Gayathri Vidya Parishad Institute of Health Care & Medical Technology, Visakhapa",gayathri-vidya-parishad-institute-of-health-care-medical-technology-visakhapa,Private,Andhra Pradesh,Visakhapa,200,,,,False,MBBS,,,,#6a0dad,,,,,,,,,,,,,,,,,
"Geetanjali Medical College & Hospital,Udaipur",geetanjali-medical-college-hospital-udaipur,Private,Rajasthan,Udaipur,250,,,,False,MBBS,,,,#6a0dad,,,,,,,,,,,,,,,,,
"Gouri Devi Institute of Medical Sciences and Hospital, Durgapur",gouri-devi-institute-of-medical-sciences-and-hospital-durgapur,Private,West Bengal,Durgapur,200,,,,False,MBBS,,,,#6a0dad,,,,,,,,,,,,,,,,,
"Great Eastern Medical School and Hospital,Srikakulam",great-eastern-medical-school-and-hospital-srikakulam,Private,Andhra Pradesh,Srikakulam,150,,,,False,MBBS,,,,#6a0dad,,,,,,,,,,,,,,,,,
"Gujarat Adani Institute of Medical Sciences, Bhuj",gujarat-adani-institute-of-medical-sciences-bhuj,Private,Gujarat,Bhuj,150,,,,False,MBBS,,,,#6a0dad,,,,,,,,,,,,,,,,,
"Heritage Institute of Medical Sciences, Varanasi",heritage-institute-of-medical-sciences-varanasi,Private,Uttar Pradesh,Varanasi,200,,,,False,MBBS,,,,#6a0dad,,,,,,,,,,,,,,,,,
"Hi-Tech Medical College & Hospital, Rourkela",hi-tech-medical-college-hospital-rourkela,Private,Odisha,Rourkela,100,,,,False,MBBS,,,,#6a0dad,,,,,,,,,,,,,,,,,
Hi-Tech Medical College and Hospital Bhubaneswar,hi-tech-medical-college-and-hospital-bhubaneswar,Private,Odisha,,150,,,,False,MBBS,,,,#6a0dad,,,,,,,,,,,,,,,,,
"Himalaya Medical College and Hospital, Patna, Bihar",himalaya-medical-college-and-hospital-patna-bihar,Private,Bihar,Bihar,150,,,,False,MBBS,,,,#6a0dad,,,,,,,,,,,,,,,,,
"Himalayan Institute of Medical Sciences, Dehradun",himalayan-institute-of-medical-sciences-dehradun,Private,Uttarakhand,Dehradun,150,,,,False,MBBS,,,,#6a0dad,,,,,,,,,,,,,,,,,
"Hind Institute of Medical Sciences , Barabanki",hind-institute-of-medical-sciences-barabanki,Private,Uttar Pradesh,Barabanki,100,,,,False,MBBS,,,,#6a0dad,,,,,,,,,,,,,,,,,
"Hind Institute of Medical Sciences, Sitapur",hind-institute-of-medical-sciences-sitapur,Private,Uttar Pradesh,Sitapur,150,,,,False,MBBS,,,,#6a0dad,,,,,,,,,,,,,,,,,
"ICARE Institute of Medical Sciences & Research, Haldia, Purba Midanpore",icare-institute-of-medical-sciences-research-haldia-purba-midanpore,Private,West Bengal,Purba Midanpore,150,,,,False,MBBS,,,,#6a0dad,,,,,,,,,,,,,,,,,
"IQ-City Medical College, Burdwan",iq-city-medical-college-burdwan,Private,West Bengal,Burdwan,250,,,,False,MBBS,,,,#6a0dad,,,,,,,,,,,,,,,,,
"Index Medical College Hospital & Research Centre,Indore",index-medical-college-hospital-research-centre-indore,Private,Madhya Pradesh,Indore,250,,,,False,MBBS,,,,#6a0dad,,,,,,,,,,,,,,,,,
"Indian Institute of Medical Science & Research, Jalna",indian-institute-of-medical-science-research-jalna,Private,Maharashtra,Jalna,150,,,,False,MBBS,,,,#6a0dad,,,,,,,,,,,,,,,,,
"Indira Medical College & Hospitals, Thiruvallur",indira-medical-college-hospitals-thiruvallur,Private,Tamil Nadu,Thiruvallur,150,,,,False,MBBS,,,,#6a0dad,,,,,,,,,,,,,,,,,
"Integral Institute of Medical Sciences & Research, Lucknow",integral-institute-of-medical-sciences-research-lucknow,Private,Uttar Pradesh,Lucknow,200,,,,False,MBBS,,,,#6a0dad,,,,,,,,,,,,,,,,,
JAGANNATH GUPTA INSTITUTE OF MEDICAL SCIENCES AND HOSPITAL,jagannath-gupta-institute-of-medical-sciences-and-hospital,Private,West Bengal,,250,,,,False,MBBS,,,,#6a0dad,,,,,,,,,,,,,,,,,
JAKIR HOSSAIN MEDICAL COLLEGE AND RESEARCH INSTITUTE,jakir-hossain-medical-college-and-research-institute,Private,West Bengal,,100,,,,False,MBBS,,,,#6a0dad,,,,,,,,,,,,,,,,,
"JIET Medical College and Hospital, Jodhpur, Rajasthan",jiet-medical-college-and-hospital-jodhpur-rajasthan,Private,Rajasthan,Rajasthan,150,,,,False,MBBS,,,,#6a0dad,,,,,,,,,,,,,,,,,
"JIS School Medical Science and Research, Howrah, WB",jis-school-medical-science-and-research-howrah-wb,Private,West Bengal,WB,150,,,,False,MBBS,,,,#6a0dad,,,,,,,,,,,,,,,,,
JJM Medical college,jjm-medical-college,Private,Karnataka,,245,,,,False,MBBS,,,,#6a0dad,,,,,,,,,,,,,,,,,
"JMN Medical College, Nadia, West Bengal",jmn-medical-college-nadia-west-bengal,Private,West Bengal,West Bengal,150,,,,False,MBBS,,,,#6a0dad,,,,,,,,,,,,,,,,,
"Jagannath Gupta Institute of Medical Sciences & Hospital, North Kolkata",jagannath-gupta-institute-of-medical-sciences-hospital-north-kolkata,Private,West Bengal,North Kolkata,100,,,,False,MBBS,,,,#6a0dad,,,,,,,,,,,,,,,,,
"Jaipur National University Institute of Medical Sciences and Resarch Centre, Jag",jaipur-national-university-institute-of-medical-sciences-and-resarch-centre-jag,Private,Rajasthan,Jag,250,,,,False,MBBS,,,,#6a0dad,,,,,,,,,,,,,,,,,
"Jubilee Mission Medical College & Research Institute, Thrissur",jubilee-mission-medical-college-research-institute-thrissur,Private,Kerala,Thrissur,150,,,,False,MBBS,,,,#6a0dad,,,,,,,,,,,,,,,,,
K J SOMAIYYA MEDICAL COLLEGE AND RESEARCH CENTRE  MUMBAI,k-j-somaiyya-medical-college-and-research-centre-mumbai,Private,Maharashtra,,100,,,,False,MBBS,,,,#6a0dad,,,,,,,,,,,,,,,,,
"K V G Medical College, Sullia",k-v-g-medical-college-sullia,Private,Karnataka,Sullia,150,,,,False,MBBS,,,,#6a0dad,,,,,,,,,,,,,,,,,
"K.D. Medical College Hospital & Research Centre, Mathura",k-d-medical-college-hospital-research-centre-mathura,Private,Uttar Pradesh,Mathura,250,,,,False,MBBS,,,,#6a0dad,,,,,,,,,,,,,,,,,
KAMINENI ACADEMY OF MEDICAL SCIENCES AND RESEARCH CENTRE,kamineni-academy-of-medical-sciences-and-research-centre,Private,Telangana,,150,,,,False,MBBS,,,,#6a0dad,,,,,,,,,,,,,,,,,
KANYAKUMARI MEDICAL MISSION RESEARCH CENTRE,kanyakumari-medical-mission-research-centre,Private,Tamil Nadu,,100,,,,False,MBBS,,,,#6a0dad,,,,,,,,,,,,,,,,,
"KIRAN MEDICAL COLLEGE, SURAT, GUJARAT",kiran-medical-college-surat-gujarat,Private,Gujarat,GUJARAT,150,,,,False,MBBS,,,,#6a0dad,,,,,,,,,,,,,,,,,
KMC Medical College and Hospital Maharajganj UP,kmc-medical-college-and-hospital-maharajganj-up,Private,Uttar Pradesh,,200,,,,False,MBBS,,,,#6a0dad,,,,,,,,,,,,,,,,,
KMCH Institute of Health Sciences and Research,kmch-institute-of-health-sciences-and-research,Private,Tamil Nadu,,150,,,,False,MBBS,,,,#6a0dad,,,,,,,,,,,,,,,,,
"KMCT Medical College,Kozhikode, Calicut",kmct-medical-college-kozhikode-calicut,Private,Kerala,Calicut,250,,,,False,MBBS,,,,#6a0dad,,,,,,,,,,,,,,,,,
"KPC Medical College,Jadavpur,Kolkata",kpc-medical-college-jadavpur-kolkata,Private,West Bengal,Kolkata,200,,,,False,MBBS,,,,#6a0dad,,,,,,,,,,,,,,,,,
"Kamineni Institute of Medical Sciences, Narketpally",kamineni-institute-of-medical-sciences-narketpally,Private,Telangana,Narketpally,200,,,,False,MBBS,,,,#6a0dad,,,,,,,,,,,,,,,,,
"Kanachur Institute of Medical Sciences, Mangalore",kanachur-institute-of-medical-sciences-mangalore,Private,Karnataka,Mangalore,200,,,,False,MBBS,,,,#6a0dad,,,,,,,,,,,,,,,,,
"Karpaga Vinayaga Institute of Medical Sciences,Maduranthagam",karpaga-vinayaga-institute-of-medical-sciences-maduranthagam,Private,Tamil Nadu,Maduranthagam,150,,,,False,MBBS,,,,#6a0dad,,,,,,,,,,,,,,,,,
Karpagam Faculty of Medical Sciences and Research,karpagam-faculty-of-medical-sciences-and-research,Private,Tamil Nadu,,150,,,,False,MBBS,,,,#6a0dad,,,,,,,,,,,,,,,,,
"Karuna Medical College, Palakkad",karuna-medical-college-palakkad,Private,Kerala,Palakkad,150,,,,False,MBBS,,,,#6a0dad,,,,,,,,,,,,,,,,,
"Katihar Medical College, Katihar",katihar-medical-college-katihar,Private,Bihar,Katihar,200,,,,False,MBBS,,,,#6a0dad,,,,,,,,,,,,,,,,,
"Katuri Medical College, Guntur",katuri-medical-college-guntur,Private,Andhra Pradesh,Guntur,150,,,,False,MBBS,,,,#6a0dad,,,,,,,,,,,,,,,,,
Kempegowda Institute of Medical Sciences,kempegowda-institute-of-medical-sciences,Private,Karnataka,,250,,,,False,MBBS,,,,#6a0dad,,,,,,,,,,,,,,,,,
"Kerala Medical College, Mangode",kerala-medical-college-mangode,Private,Kerala,Mangode,150,,,,False,MBBS,,,,#6a0dad,,,,,,,,,,,,,,,,,
"Khaja Bandanawaz University - Faculty of Medical Sciences, Gulbarga",khaja-bandanawaz-university-faculty-of-medical-sciences-gulbarga,Private,Karnataka,Gulbarga,150,,,,False,MBBS,,,,#6a0dad,,,,,,,,,,,,,,,,,
"Konaseema Institute of Medical Sciences & Research Foundation, Amalapuram",konaseema-institute-of-medical-sciences-research-foundation-amalapuram,Private,Andhra Pradesh,Amalapuram,200,,,,False,MBBS,,,,#6a0dad,,,,,,,,,,,,,,,,,
"Krishna Mohan Medical College & Hospital, Mathura",krishna-mohan-medical-college-hospital-mathura,Private,Uttar Pradesh,Mathura,200,,,,False,MBBS,,,,#6a0dad,,,,,,,,,,,,,,,,,
"Krishnanagar Institute of Medical Science, Nadia, West Bengal",krishnanagar-institute-of-medical-science-nadia-west-bengal,Private,West Bengal,West Bengal,150,,,,False,MBBS,,,,#6a0dad,,,,,,,,,,,,,,,,,
"L.N. Medical College and Research Centre,Bhopal",l-n-medical-college-and-research-centre-bhopal,Private,Madhya Pradesh,Bhopal,250,,,,False,MBBS,,,,#6a0dad,,,,,,,,,,,,,,,,,
"LNCT Medical College & Sewakunj Hospital, Indore",lnct-medical-college-sewakunj-hospital-indore,Private,Madhya Pradesh,Indore,150,,,,False,MBBS,,,,#6a0dad,,,,,,,,,,,,,,,,,
Laxmi Chandravansi Medical College & Hospital,laxmi-chandravansi-medical-college-hospital,Private,Jharkhand,,100,,,,False,MBBS,,,,#6a0dad,,,,,,,,,,,,,,,,,
"Lord Buddha Koshi Medical College and Hospital, Saharsa",lord-buddha-koshi-medical-college-and-hospital-saharsa,Private,Bihar,Saharsa,150,,,,False,MBBS,,,,#6a0dad,,,,,,,,,,,,,,,,,
"M E S Medical College , Perintalmanna Malappuram Distt.Kerala",m-e-s-medical-college-perintalmanna-malappuram-distt-kerala,Private,Kerala,Perintalmanna Malappuram Distt.Kerala,150,,,,False,MBBS,,,,#6a0dad,,,,,,,,,,,,,,,,,
"M.M. COLLEGE OF MEDICAL SCIENCES & RESEARCH, AMBALA",m-m-college-of-medical-sciences-research-ambala,Private,Haryana,AMBALA,150,,,,False,MBBS,,,,#6a0dad,,,,,,,,,,,,,,,,,
MAHABODHI MEDICAL COLLEGE & HOSPITAL,mahabodhi-medical-college-hospital,Private,Bihar,,100,,,,False,MBBS,,,,#6a0dad,,,,,,,,,,,,,,,,,
MAHARISHI MARKANDESHWAR MEDICAL COLLEGE & HOSPITAL,maharishi-markandeshwar-medical-college-hospital,Private,Himachal Pradesh,,150,,,,False,MBBS,,,,#6a0dad,,,,,,,,,,,,,,,,,
MALATI MULTISPECIALITY HOSPITAL AND MEDICAL COLLEGE,malati-multispeciality-hospital-and-medical-college,Private,Maharashtra,,50,,,,False,MBBS,,,,#6a0dad,,,,,,,,,,,,,,,,,
MANSAROVAR MEDICAL COLLEGE AND MGU HOSPITAL,mansarovar-medical-college-and-mgu-hospital,Private,Madhya Pradesh,,150,,,,False,MBBS,,,,#6a0dad,,,,,,,,,,,,,,,,,
"MNR Medical College & Hospital, Sangareddy",mnr-medical-college-hospital-sangareddy,Private,Telangana,Sangareddy,150,,,,False,MBBS,,,,#6a0dad,,,,,,,,,,,,,,,,,
"MVJ Medical College and Research Hospital, Bangalore",mvj-medical-college-and-research-hospital-bangalore,Private,Karnataka,Bangalore,250,,,,False,MBBS,,,,#6a0dad,,,,,,,,,,,,,,,,,
"Madha Medical College and Hospital, Thandalam, Chennai",madha-medical-college-and-hospital-thandalam-chennai,Private,Tamil Nadu,Chennai,150,,,,False,MBBS,,,,#6a0dad,,,,,,,,,,,,,,,,,
"Madhubani Medical College, Madhubani",madhubani-medical-college-madhubani,Private,Bihar,Madhubani,250,,,,False,MBBS,,,,#6a0dad,,,,,,,,,,,,,,,,,
Mahadevappa Rampure Medical College,mahadevappa-rampure-medical-college,Private,Karnataka,,200,,,,False,MBBS,,,,#6a0dad,,,,,,,,,,,,,,,,,
"Maharajah Institute of Medical Sciences, Vizianagaram",maharajah-institute-of-medical-sciences-vizianagaram,Private,Andhra Pradesh,Vizianagaram,200,,,,False,MBBS,,,,#6a0dad,,,,,,,,,,,,,,,,,
"Maharashtra Institute of Medical  Sciences & Research, Latur",maharashtra-institute-of-medical-sciences-research-latur,Private,Maharashtra,Latur,150,,,,False,MBBS,,,,#6a0dad,,,,,,,,,,,,,,,,,
"Maharashtra Institute of Medical Education & Research, Talegaon,Pune",maharashtra-institute-of-medical-education-research-talegaon-pune,Private,Maharashtra,Pune,150,,,,False,MBBS,,,,#6a0dad,,,,,,,,,,,,,,,,,
"Mahatma Gandhi Medical College, Jaipur",mahatma-gandhi-medical-college-jaipur,Private,Rajasthan,Jaipur,250,,,,False,MBBS,,,,#6a0dad,,,,,,,,,,,,,,,,,
"Mahaveer Institute of Medical Sciences & Research, Bhopal",mahaveer-institute-of-medical-sciences-research-bhopal,Private,Madhya Pradesh,Bhopal,150,,,,False,MBBS,,,,#6a0dad,,,,,,,,,,,,,,,,,
"Mahavir Institute of Medical Sciences, Vikarabad, Telengana",mahavir-institute-of-medical-sciences-vikarabad-telengana,Private,Telangana,Telengana,200,,,,False,MBBS,,,,#6a0dad,,,,,,,,,,,,,,,,,
"Maheshwara Medical College, Chitkul, Patancheru, Medak",maheshwara-medical-college-chitkul-patancheru-medak,Private,Telangana,Medak,150,,,,False,MBBS,,,,#6a0dad,,,,,,,,,,,,,,,,,
"Malabar Medical College, Kozhikode,Calicut",malabar-medical-college-kozhikode-calicut,Private,Kerala,Calicut,250,,,,False,MBBS,,,,#6a0dad,,,,,,,,,,,,,,,,,
Malankara Orthodox Syrian Church Medical College,malankara-orthodox-syrian-church-medical-college,Private,Kerala,,100,,,,False,MBBS,,,,#6a0dad,,,,,,,,,,,,,,,,,
"Mamata Academy of Medical Sciences, Bachupally",mamata-academy-of-medical-sciences-bachupally,Private,Telangana,Bachupally,150,,,,False,MBBS,,,,#6a0dad,,,,,,,,,,,,,,,,,
"Mamata Medical College, Khammam",mamata-medical-college-khammam,Private,Telangana,Khammam,200,,,,False,MBBS,,,,#6a0dad,,,,,,,,,,,,,,,,,
Mata Gujri Memorial Medical College KISHANGANJ,mata-gujri-memorial-medical-college-kishanganj,Private,Bihar,,150,,,,False,MBBS,,,,#6a0dad,,,,,,,,,,,,,,,,,
Matushri prabhaben khodabhai boghara medical college & research centre,matushri-prabhaben-khodabhai-boghara-medical-college-research-centre,Private,Gujarat,,150,,,,False,MBBS,,,,#6a0dad,,,,,,,,,,,,,,,,,
"Mayo Institute of Medical Sciences, Barabanki",mayo-institute-of-medical-sciences-barabanki,Private,Uttar Pradesh,Barabanki,250,,,,False,MBBS,,,,#6a0dad,,,,,,,,,,,,,,,,,
"Mediciti Institute Of Medical Sciences, Ghanpur",mediciti-institute-of-medical-sciences-ghanpur,Private,Telangana,Ghanpur,150,,,,False,MBBS,,,,#6a0dad,,,,,,,,,,,,,,,,,
Melmaruvathur Adiparasakthi Instt. Medical Sciences  and Research,melmaruvathur-adiparasakthi-instt-medical-sciences-and-research,Private,Tamil Nadu,,150,,,,False,MBBS,,,,#6a0dad,,,,,,,,,,,,,,,,,
"Mount Zion Medical College, Chayalode, Ezhamkulam Adoor, Pathanamthitta",mount-zion-medical-college-chayalode-ezhamkulam-adoor-pathanamthitta,Private,Kerala,Pathanamthitta,150,,,,False,MBBS,,,,#6a0dad,,,,,,,,,,,,,,,,,
"Muzaffarnagar Medical College, Muzaffarnagar",muzaffarnagar-medical-college-muzaffarnagar,Private,Uttar Pradesh,Muzaffarnagar,200,,,,False,MBBS,,,,#6a0dad,,,,,,,,,,,,,,,,,
N. K. P. Salve Instt. of Medical Sciences and Research Centre and Lata Mangeshka,n-k-p-salve-instt-of-medical-sciences-and-research-centre-and-lata-mangeshka,Private,Maharashtra,,250,,,,False,MBBS,,,,#6a0dad,,,,,,,,,,,,,,,,,
"N.C. Medical College & Hospital, Panipat",n-c-medical-college-hospital-panipat,Private,Haryana,Panipat,200,,,,False,MBBS,,,,#6a0dad,,,,,,,,,,,,,,,,,
NOVA INSTITUTE OF MEDICAL SCIENCES AND RESEARCH CENTRE,nova-institute-of-medical-sciences-and-research-centre,Private,Telangana,,250,,,,False,MBBS,,,,#6a0dad,,,,,,,,,,,,,,,,,
"NRI Institute of Medical Sciences, Visakhapatnam",nri-institute-of-medical-sciences-visakhapatnam,Private,Andhra Pradesh,Visakhapatnam,250,,,,False,MBBS,,,,#6a0dad,,,,,,,,,,,,,,,,,
"NRI Medical College, Guntur",nri-medical-college-guntur,Private,Andhra Pradesh,Guntur,200,,,,False,MBBS,,,,#6a0dad,,,,,,,,,,,,,,,,,
"Nandha Medical College & Hospital, Erode, Tamil Nadu",nandha-medical-college-hospital-erode-tamil-nadu,Private,Tamil Nadu,Tamil Nadu,150,,,,False,MBBS,,,,#6a0dad,,,,,,,,,,,,,,,,,
Naraina Medical College and Research Centre,naraina-medical-college-and-research-centre,Private,Uttar Pradesh,,250,,,,False,MBBS,,,,#6a0dad,,,,,,,,,,,,,,,,,
"Narayan Medical College & Hospital, Sasaram",narayan-medical-college-hospital-sasaram,Private,Bihar,Sasaram,250,,,,False,MBBS,,,,#6a0dad,,,,,,,,,,,,,,,,,
"Narayana Medical College, Nellore",narayana-medical-college-nellore,Private,Andhra Pradesh,Nellore,250,,,,False,MBBS,,,,#6a0dad,,,,,,,,,,,,,,,,,
"National Capital Region Institute of Medical Sciences, Meerut",national-capital-region-institute-of-medical-sciences-meerut,Private,Uttar Pradesh,Meerut,200,,,,False,MBBS,,,,#6a0dad,,,,,,,,,,,,,,,,,
"National Institute of Medical Science & Research, Jaipur",national-institute-of-medical-science-research-jaipur,Private,Rajasthan,Jaipur,250,,,,False,MBBS,,,,#6a0dad,,,,,,,,,,,,,,,,,
"Navodaya Medical College, Raichur",navodaya-medical-college-raichur,Private,Karnataka,Raichur,200,,,,False,MBBS,,,,#6a0dad,,,,,,,,,,,,,,,,,
"Neelima Institute of Medical Sciences, Telangana",neelima-institute-of-medical-sciences-telangana,Private,Telangana,Telangana,200,,,,False,MBBS,,,,#6a0dad,,,,,,,,,,,,,,,,,
"Netaji Subhas Medical College & Hospital, Amhara, Bihta, Patna",netaji-subhas-medical-college-hospital-amhara-bihta-patna,Private,Bihar,Patna,150,,,,False,MBBS,,,,#6a0dad,,,,,,,,,,,,,,,,,
"Netaji Subhas Medical College & Hospital, Seraikala,Jharkhand",netaji-subhas-medical-college-hospital-seraikala-jharkhand,Private,Jharkhand,Jharkhand,100,,,,False,MBBS,,,,#6a0dad,,,,,,,,,,,,,,,,,
"Nimra Institute of Medical Sciences, Krishna Dist., A.P.",nimra-institute-of-medical-sciences-krishna-dist-a-p,Private,Andhra Pradesh,A.P.,200,,,,False,MBBS,,,,#6a0dad,,,,,,,,,,,,,,,,,
Noida International Institute Of Medical Sciences,noida-international-institute-of-medical-sciences,Private,Uttar Pradesh,,150,,,,False,MBBS,,,,#6a0dad,,,,,,,,,,,,,,,,,
"Nootan Medical College and Research Centre, Mehsana",nootan-medical-college-and-research-centre-mehsana,Private,Gujarat,Mehsana,150,,,,False,MBBS,,,,#6a0dad,,,,,,,,,,,,,,,,,
"P E S Institute Of Medical Sciences and Research, Kuppam",p-e-s-institute-of-medical-sciences-and-research-kuppam,Private,Andhra Pradesh,Kuppam,150,,,,False,MBBS,,,,#6a0dad,,,,,,,,,,,,,,,,,
"P K Das Institute of Medical Sciences, Palakkad, Kerala",p-k-das-institute-of-medical-sciences-palakkad-kerala,Private,Kerala,Kerala,250,,,,False,MBBS,,,,#6a0dad,,,,,,,,,,,,,,,,,
PA Sangma International Medical College & Hospital,pa-sangma-international-medical-college-hospital,Private,Meghalaya,,100,,,,False,MBBS,,,,#6a0dad,,,,,,,,,,,,,,,,,
PACIFIC INSTITUTE OF MEDICAL SCIENCES Umarda,pacific-institute-of-medical-sciences-umarda,Private,Rajasthan,,250,,,,False,MBBS,,,,#6a0dad,,,,,,,,,,,,,,,,,
PALAKKAD INSTITUTE OF MEDICAL SCIENCES,palakkad-institute-of-medical-sciences,Private,Kerala,,100,,,,False,MBBS,,,,#6a0dad,,,,,,,,,,,,,,,,,
"PARBHANI MEDICAL COLLEGE, PARBHANI",parbhani-medical-college-parbhani,Private,Maharashtra,PARBHANI,150,,,,False,MBBS,,,,#6a0dad,,,,,,,,,,,,,,,,,
"PES University Institute of Medical Sciences & Research, Bangalore",pes-university-institute-of-medical-sciences-research-bangalore,Private,Karnataka,Bangalore,150,,,,False,MBBS,,,,#6a0dad,,,,,,,,,,,,,,,,,
PKG MEDICAL COLLEGE,pkg-medical-college,Private,West Bengal,,50,,,,False,MBBS,,,,#6a0dad,,,,,,,,,,,,,,,,,
"PSG Institute of Medical Sciences, Coimbatore",psg-institute-of-medical-sciences-coimbatore,Private,Tamil Nadu,Coimbatore,250,,,,False,MBBS,,,,#6a0dad,,,,,,,,,,,,,,,,,
"PSP MEDICAL COLLEGE HOSPITAL AND RESEARCH INSTITUTE, Tamil Nadu",psp-medical-college-hospital-and-research-institute-tamil-nadu,Private,Tamil Nadu,Tamil Nadu,100,,,,False,MBBS,,,,#6a0dad,,,,,,,,,,,,,,,,,
"Pacific Medical College & Hospital, Bhilo Ka Bedla, Udaipur",pacific-medical-college-hospital-bhilo-ka-bedla-udaipur,Private,Rajasthan,Udaipur,200,,,,False,MBBS,,,,#6a0dad,,,,,,,,,,,,,,,,,
Panimalar Medical College Hospital & Research Institute,panimalar-medical-college-hospital-research-institute,Private,Tamil Nadu,,200,,,,False,MBBS,,,,#6a0dad,,,,,,,,,,,,,,,,,
"Parul Institute of Medical Sciences & Research, Vadodara",parul-institute-of-medical-sciences-research-vadodara,Private,Gujarat,Vadodara,200,,,,False,MBBS,,,,#6a0dad,,,,,,,,,,,,,,,,,
"Peoples College of Medical Sciences & Research Centre, Bhanpur, Bhopal",peoples-college-of-medical-sciences-research-centre-bhanpur-bhopal,Private,Madhya Pradesh,Bhopal,250,,,,False,MBBS,,,,#6a0dad,,,,,,,,,,,,,,,,,
"Prakash Institute of Medical Sciences & Research, Sangli",prakash-institute-of-medical-sciences-research-sangli,Private,Maharashtra,Sangli,150,,,,False,MBBS,,,,#6a0dad,,,,,,,,,,,,,,,,,
Pramukhswami Medical College,pramukhswami-medical-college,Private,Gujarat,,150,,,,False,MBBS,,,,#6a0dad,,,,,,,,,,,,,,,,,
"Prasad Institute of Medical Sciences, Lucknow",prasad-institute-of-medical-sciences-lucknow,Private,Uttar Pradesh,Lucknow,150,,,,False,MBBS,,,,#6a0dad,,,,,,,,,,,,,,,,,
"Prathima Institute Of Medical Sciences, Karimnagar",prathima-institute-of-medical-sciences-karimnagar,Private,Telangana,Karimnagar,250,,,,False,MBBS,,,,#6a0dad,,,,,,,,,,,,,,,,,
"Prathima Relief Institute of Medical Sciences, Hanamkonda",prathima-relief-institute-of-medical-sciences-hanamkonda,Private,Telangana,Hanamkonda,150,,,,False,MBBS,,,,#6a0dad,,,,,,,,,,,,,,,,,
"Puducherry Institute of Medical Sciences & Research, Pondicherry",puducherry-institute-of-medical-sciences-research-pondicherry,Private,Pondicherry,Pondicherry,150,,,,False,MBBS,,,,#6a0dad,,,,,,,,,,,,,,,,,
"Punjab Institute of Medical Sciences, Jalandhar",punjab-institute-of-medical-sciences-jalandhar,Private,Punjab,Jalandhar,150,,,,False,MBBS,,,,#6a0dad,,,,,,,,,,,,,,,,,
"Pushpagiri Institute Of Medical Sciences and Research Centre, Tiruvalla",pushpagiri-institute-of-medical-sciences-and-research-centre-tiruvalla,Private,Kerala,Tiruvalla,100,,,,False,MBBS,,,,#6a0dad,,,,,,,,,,,,,,,,,
"R.V.M. Institute of Medical Sciences and Research Centre, Siddipet",r-v-m-institute-of-medical-sciences-and-research-centre-siddipet,Private,Telangana,Siddipet,250,,,,False,MBBS,,,,#6a0dad,,,,,,,,,,,,,,,,,
"RAM KRISHNA MEDICAL COLLEGE HOSPITAL AND RESEARCH CENTRE, BHOPAL",ram-krishna-medical-college-hospital-and-research-centre-bhopal,Private,Madhya Pradesh,BHOPAL,150,,,,False,MBBS,,,,#6a0dad,,,,,,,,,,,,,,,,,
RANIGANJ INSTITUTE OF MEDICAL SCIENCE,raniganj-institute-of-medical-science,Private,West Bengal,,100,,,,False,MBBS,,,,#6a0dad,,,,,,,,,,,,,,,,,
"RIMT Medical College and Hospital Fatehgarh, Sahib, Punjab",rimt-medical-college-and-hospital-fatehgarh-sahib-punjab,Private,Punjab,Punjab,50,,,,False,MBBS,,,,#6a0dad,,,,,,,,,,,,,,,,,
"RKDF Medical College Hospital & Research Centre, Jatkhedi, Bhopal",rkdf-medical-college-hospital-research-centre-jatkhedi-bhopal,Private,Madhya Pradesh,Bhopal,150,,,,False,MBBS,,,,#6a0dad,,,,,,,,,,,,,,,,,
Radha Devi Jageshwari Memorial Medical College and Hospital,radha-devi-jageshwari-memorial-medical-college-and-hospital,Private,Bihar,,200,,,,False,MBBS,,,,#6a0dad,,,,,,,,,,,,,,,,,
"Raipur Institute of Medical Sciences (RIMS), Raipur",raipur-institute-of-medical-sciences-rims-raipur,Private,Chattisgarh,Raipur,150,,,,False,MBBS,,,,#6a0dad,,,,,,,,,,,,,,,,,
"Rajshree Medical Research Institute, Bareilly",rajshree-medical-research-institute-bareilly,Private,Uttar Pradesh,Bareilly,250,,,,False,MBBS,,,,#6a0dad,,,,,,,,,,,,,,,,,
"Rama Medical College Hospital and Research Centre, Hapur",rama-medical-college-hospital-and-research-centre-hapur,Private,Uttar Pradesh,Hapur,250,,,,False,MBBS,,,,#6a0dad,,,,,,,,,,,,,,,,,
"Rama Medical College and Hospital , Kanpur",rama-medical-college-and-hospital-kanpur,Private,Uttar Pradesh,Kanpur,150,,,,False,MBBS,,,,#6a0dad,,,,,,,,,,,,,,,,,
"Rohilkhand Medical College & Hospital, Bareilly",rohilkhand-medical-college-hospital-bareilly,Private,Uttar Pradesh,Bareilly,250,,,,False,MBBS,,,,#6a0dad,,,,,,,,,,,,,,,,,
"Ruxmaniben Deepchand Gardi Medical College, Ujjain",ruxmaniben-deepchand-gardi-medical-college-ujjain,Private,Madhya Pradesh,Ujjain,150,,,,False,MBBS,,,,#6a0dad,,,,,,,,,,,,,,,,,
"S R PATIL MEDICAL COLLEGE, HOSPITAL & RESEARCH CENTRE, BADAGANDI, Bagalkot, Karn",s-r-patil-medical-college-hospital-research-centre-badagandi-bagalkot-karn,Private,Karnataka,Karn,100,,,,False,MBBS,,,,#6a0dad,,,,,,,,,,,,,,,,,
"S S Institute of Medical Sciences& Research Centre, Davangere",s-s-institute-of-medical-sciences-research-centre-davangere,Private,Karnataka,Davangere,200,,,,False,MBBS,,,,#6a0dad,,,,,,,,,,,,,,,,,
"S V S Medical College, Mehboobnagar",s-v-s-medical-college-mehboobnagar,Private,Telangana,Mehboobnagar,150,,,,False,MBBS,,,,#6a0dad,,,,,,,,,,,,,,,,,
"S. Nijalingappa Medical College & HSK Hospital & Research Centre, Bagalkot",s-nijalingappa-medical-college-hsk-hospital-research-centre-bagalkot,Private,Karnataka,Bagalkot,250,,,,False,MBBS,,,,#6a0dad,,,,,,,,,,,,,,,,,
"SAL Institute of Medical Sciences, Ahmadabad",sal-institute-of-medical-sciences-ahmadabad,Private,Gujarat,Ahmadabad,150,,,,False,MBBS,,,,#6a0dad,,,,,,,,,,,,,,,,,
SANTINIKETAN MEDICAL COLLEGE,santiniketan-medical-college,Private,West Bengal,,150,,,,False,MBBS,,,,#6a0dad,,,,,,,,,,,,,,,,,
SCHOOL OF MEDICAL SCIENCES SRI SATYA SAI UNIVERSITY OF TECHNOLOGY AND MEDICAL SC,school-of-medical-sciences-sri-satya-sai-university-of-technology-and-medical-sc,Private,Madhya Pradesh,,100,,,,False,MBBS,,,,#6a0dad,,,,,,,,,,,,,,,,,
"SDM College of Medical Sciences & Hospital, Sattur, Dharwad",sdm-college-of-medical-sciences-hospital-sattur-dharwad,Private,Karnataka,Dharwad,150,,,,False,MBBS,,,,#6a0dad,,,,,,,,,,,,,,,,,
