name,slug,type,state,city,seats,annual_fees,closing_rank_open,nirf_rank,asmi_recommended,course,established_year,hospital_beds,photo,photo_placeholder_color,contact_phone,contact_email,website,address,affiliated_university,opd_daily,bond_years,bond_penalty,hostel_available,asmi_pulse_score,asmi_verdict,description,attached_hospital,nearby_airport,nearby_railway_station,google_location,pg_courses_availability
"Indira Gandhi Institute of Medical Sciences,Sheikhpura, Patna",indira-gandhi-institute-of-medical-sciences-sheikhpura-patna,Government,Bihar,Patna,150,,,,False,MBBS,,,,#15803d,,,,,,,,,,,,,,,,,
"Indira Gandhi Medical College & Hospital, Nagpur",indira-gandhi-medical-college-hospital-nagpur,Government,Maharashtra,Nagpur,200,,,,False,MBBS,,,,#15803d,,,,,,,,,,,,,,,,,
"Indira Gandhi Medical College & Research Institute, Puducherry",indira-gandhi-medical-college-research-institute-puducherry,Government,Pondicherry,Puducherry,180,,,,False,MBBS,,,,#15803d,,,,,,,,,,,,,,,,,
"Indira Gandhi Medical College, Shimla",indira-gandhi-medical-college-shimla,Government,Himachal Pradesh,Shimla,120,,,,False,MBBS,,,,#15803d,,,,,,,,,,,,,,,,,
"Institute of Postgraduate Medical Education & Research, Kolkata",institute-of-postgraduate-medical-education-research-kolkata,Government,West Bengal,Kolkata,200,,,,False,MBBS,,,,#15803d,,,,,,,,,,,,,,,,,
"JANNAYAK KARPOORI THAKUR MEDICAL COLLEGE AND HOSPITAL, MADHEPURA, BIHAR",jannayak-karpoori-thakur-medical-college-and-hospital-madhepura-bihar,Government,Bihar,BIHAR,100,,,,False,MBBS,,,,#15803d,,,,,,,,,,,,,,,,,
"Jalpaiguri Government Medical College and Hospital, Jalpaiguri, West Bengal",jalpaiguri-government-medical-college-and-hospital-jalpaiguri-west-bengal,Government,West Bengal,West Bengal,100,,,,False,MBBS,,,,#15803d,,,,,,,,,,,,,,,,,
Jawaharlal Nehru Institute of Medical Sciences,jawaharlal-nehru-institute-of-medical-sciences,Government,Manipur,,150,,,,False,MBBS,,,,#15803d,,,,,,,,,,,,,,,,,
"Jawaharlal Nehru Medical College, Ajmer",jawaharlal-nehru-medical-college-ajmer,Government,Rajasthan,Ajmer,250,,,,False,MBBS,,,,#15803d,,,,,,,,,,,,,,,,,
"Jawaharlal Nehru Medical College, Bhagalpur",jawaharlal-nehru-medical-college-bhagalpur,Government,Bihar,Bhagalpur,120,,,,False,MBBS,,,,#15803d,,,,,,,,,,,,,,,,,
"Jhalawar Medical College, Jhalawar",jhalawar-medical-college-jhalawar,Government,Rajasthan,Jhalawar,200,,,,False,MBBS,,,,#15803d,,,,,,,,,,,,,,,,,
"Jhargram Government Medical College And Hospital, WB",jhargram-government-medical-college-and-hospital-wb,Government,West Bengal,WB,100,,,,False,MBBS,,,,#15803d,,,,,,,,,,,,,,,,,
Jorhat Medical College and Hospital,jorhat-medical-college-and-hospital,Government,Assam,,125,,,,False,MBBS,,,,#15803d,,,,,,,,,,,,,,,,,
"K A P Viswanathan Government Medical College, Trichy",k-a-p-viswanathan-government-medical-college-trichy,Government,Tamil Nadu,Trichy,150,,,,False,MBBS,,,,#15803d,,,,,,,,,,,,,,,,,
"Kakatiya Medical College, Warangal",kakatiya-medical-college-warangal,Government,Telangana,Warangal,250,,,,False,MBBS,,,,#15803d,,,,,,,,,,,,,,,,,
"Kalpana Chawala Govt. Medical College, Karnal, Haryana",kalpana-chawala-govt-medical-college-karnal-haryana,Government,Haryana,Haryana,120,,,,False,MBBS,,,,#15803d,,,,,,,,,,,,,,,,,
"Kalyan Singh Government medical college, Bulandshahr, UP",kalyan-singh-government-medical-college-bulandshahr-up,Government,Uttar Pradesh,UP,100,,,,False,MBBS,,,,#15803d,,,,,,,,,,,,,,,,,
"KanyaKumari Government Medical College, Asaripallam",kanyakumari-government-medical-college-asaripallam,Government,Tamil Nadu,Asaripallam,150,,,,False,MBBS,,,,#15803d,,,,,,,,,,,,,,,,,
"Karnataka Institute of Medical Sciences, Hubballi",karnataka-institute-of-medical-sciences-hubballi,Government,Karnataka,Hubballi,200,,,,False,MBBS,,,,#15803d,,,,,,,,,,,,,,,,,
"Karwar Institute of Medical Sciences, Karwar",karwar-institute-of-medical-sciences-karwar,Government,Karnataka,Karwar,150,,,,False,MBBS,,,,#15803d,,,,,,,,,,,,,,,,,
"Kilpauk Medical College, Chennai",kilpauk-medical-college-chennai,Government,Tamil Nadu,Chennai,150,,,,False,MBBS,,,,#15803d,,,,,,,,,,,,,,,,,
"King George Medical University, Lucknow",king-george-medical-university-lucknow,Government,Uttar Pradesh,Lucknow,250,,,,False,MBBS,,,,#15803d,,,,,,,,,,,,,,,,,
"Kodagu Institute of Medical Sciences, Kodagu",kodagu-institute-of-medical-sciences-kodagu,Government,Karnataka,Kodagu,150,,,,False,MBBS,,,,#15803d,,,,,,,,,,,,,,,,,
"Kokrajhar Medical College, Assam",kokrajhar-medical-college-assam,Government,Assam,Assam,100,,,,False,MBBS,,,,#15803d,,,,,,,,,,,,,,,,,
"Koppal Institute of Medical Sciences, Koppal",koppal-institute-of-medical-sciences-koppal,Government,Karnataka,Koppal,150,,,,False,MBBS,,,,#15803d,,,,,,,,,,,,,,,,,
"Kurnool Medical College, Kurnool",kurnool-medical-college-kurnool,Government,Andhra Pradesh,Kurnool,250,,,,False,MBBS,,,,#15803d,,,,,,,,,,,,,,,,,
LAKHIMPUR MEDICAL COLLEGE,lakhimpur-medical-college,Government,Assam,,100,,,,False,MBBS,,,,#15803d,,,,,,,,,,,,,,,,,
"LLRM Medical College, Meerut",llrm-medical-college-meerut,Government,Uttar Pradesh,Meerut,150,,,,False,MBBS,,,,#15803d,,,,,,,,,,,,,,,,,
"Lady Hardinge Medical College, New Delhi",lady-hardinge-medical-college-new-delhi,Government,Delhi,New Delhi,240,,,,False,MBBS,,,,#15803d,,,,,,,,,,,,,,,,,
"Late Shri Baliram Kashyap Memorial NDMC Govt. Medical College, Jagdalpur",late-shri-baliram-kashyap-memorial-ndmc-govt-medical-college-jagdalpur,Government,Chattisgarh,Jagdalpur,125,,,,False,MBBS,,,,#15803d,,,,,,,,,,,,,,,,,
"Late Shri Lakhi Ram Agrawal Memorial Govt. Medical College, Raigarh",late-shri-lakhi-ram-agrawal-memorial-govt-medical-college-raigarh,Government,Chattisgarh,Raigarh,100,,,,False,MBBS,,,,#15803d,,,,,,,,,,,,,,,,,
Late. Bisahu Das Mahant Memorial Medical College Korba C.G.,late-bisahu-das-mahant-memorial-medical-college-korba-c-g,Government,Chattisgarh,,125,,,,False,MBBS,,,,#15803d,,,,,,,,,,,,,,,,,
"Lokmanya Tilak Municipal Medical College, Sion, Mumbai",lokmanya-tilak-municipal-medical-college-sion-mumbai,Government,Maharashtra,Mumbai,200,,,,False,MBBS,,,,#15803d,,,,,,,,,,,,,,,,,
"M G M Medical College, Indore",m-g-m-medical-college-indore,Government,Madhya Pradesh,Indore,250,,,,False,MBBS,,,,#15803d,,,,,,,,,,,,,,,,,
"M G M Medical College, Jamshedpur",m-g-m-medical-college-jamshedpur,Government,Jharkhand,Jamshedpur,150,,,,False,MBBS,,,,#15803d,,,,,,,,,,,,,,,,,
MAHATMA VIDUR AUTONOMOUS STATE MEDICAL COLLEGE BIJNOR  UP,mahatma-vidur-autonomous-state-medical-college-bijnor-up,Government,Uttar Pradesh,,100,,,,False,MBBS,,,,#15803d,,,,,,,,,,,,,,,,,
"MEDICAL COLLEGE, BARODA",medical-college-baroda,Government,Gujarat,BARODA,250,,,,False,MBBS,,,,#15803d,,,,,,,,,,,,,,,,,
"MKCG Medical College, Berhampur",mkcg-medical-college-berhampur,Government,Odisha,Berhampur,250,,,,False,MBBS,,,,#15803d,,,,,,,,,,,,,,,,,
"MP SHAH MEDICAL COLLEGE, JAMNAGAR",mp-shah-medical-college-jamnagar,Government,Gujarat,JAMNAGAR,250,,,,False,MBBS,,,,#15803d,,,,,,,,,,,,,,,,,
"MYSORE MEDICAL COLLEGE AND RESEARCH INSTITUTE, MYSURU",mysore-medical-college-and-research-institute-mysuru,Government,Karnataka,MYSURU,250,,,,False,MBBS,,,,#15803d,,,,,,,,,,,,,,,,,
"Madras Medical College, Chennai",madras-medical-college-chennai,Government,Tamil Nadu,Chennai,250,,,,False,MBBS,,,,#15803d,,,,,,,,,,,,,,,,,
"Madurai Medical College, Madurai",madurai-medical-college-madurai,Government,Tamil Nadu,Madurai,250,,,,False,MBBS,,,,#15803d,,,,,,,,,,,,,,,,,
"Mahamaya Rajkiya Allopathic Medical College, Ambedkarnagar",mahamaya-rajkiya-allopathic-medical-college-ambedkarnagar,Government,Uttar Pradesh,Ambedkarnagar,100,,,,False,MBBS,,,,#15803d,,,,,,,,,,,,,,,,,
"Maharani Laxmi Bai Medical College, Jhansi",maharani-laxmi-bai-medical-college-jhansi,Government,Uttar Pradesh,Jhansi,150,,,,False,MBBS,,,,#15803d,,,,,,,,,,,,,,,,,
"Maharishi Chyawan Medical College, Koriawas",maharishi-chyawan-medical-college-koriawas,Government,Haryana,Koriawas,100,,,,False,MBBS,,,,#15803d,,,,,,,,,,,,,,,,,
"Maharshi Devraha Baba Autonomous State Medical College, Deoria",maharshi-devraha-baba-autonomous-state-medical-college-deoria,Government,Uttar Pradesh,Deoria,100,,,,False,MBBS,,,,#15803d,,,,,,,,,,,,,,,,,
"Mahatma Gandhi Institute of Medical Sciences, Sevagram, Wardha",mahatma-gandhi-institute-of-medical-sciences-sevagram-wardha,Government,Maharashtra,Wardha,100,,,,False,MBBS,,,,#15803d,,,,,,,,,,,,,,,,,
"Malda Medical College & Hospital, Malda",malda-medical-college-hospital-malda,Government,West Bengal,Malda,125,,,,False,MBBS,,,,#15803d,,,,,,,,,,,,,,,,,
"Mandya Institute of Medical Sciences, Mandya",mandya-institute-of-medical-sciences-mandya,Government,Karnataka,Mandya,150,,,,False,MBBS,,,,#15803d,,,,,,,,,,,,,,,,,
"Medical College, Thiruvananthapuram",medical-college-thiruvananthapuram,Government,Kerala,Thiruvananthapuram,250,,,,False,MBBS,,,,#15803d,,,,,,,,,,,,,,,,,
"Medinirai Medical College & Hospital, Palamu",medinirai-medical-college-hospital-palamu,Government,Jharkhand,Palamu,100,,,,False,MBBS,,,,#15803d,,,,,,,,,,,,,,,,,
"Midnapore Medical College, Midnapore",midnapore-medical-college-midnapore,Government,West Bengal,Midnapore,200,,,,False,MBBS,,,,#15803d,,,,,,,,,,,,,,,,,
"Moti Lal Nehru Medical College, Allahabad",moti-lal-nehru-medical-college-allahabad,Government,Uttar Pradesh,Allahabad,200,,,,False,MBBS,,,,#15803d,,,,,,,,,,,,,,,,,
"Murshidabad Medical College & Hospitals, Murshidabad",murshidabad-medical-college-hospitals-murshidabad,Government,West Bengal,Murshidabad,125,,,,False,MBBS,,,,#15803d,,,,,,,,,,,,,,,,,
"NAMO Medical Education and Research Institute, Silvassa",namo-medical-education-and-research-institute-silvassa,Government,Dadra and Nagar Haveli,Silvassa,177,,,,False,MBBS,,,,#15803d,,,,,,,,,,,,,,,,,
"Nagaland Institute of Medical Sciences and Research, Nagaland",nagaland-institute-of-medical-sciences-and-research-nagaland,Government,Nagaland,Nagaland,100,,,,False,MBBS,,,,#15803d,,,,,,,,,,,,,,,,,
Nagaon Medical College,nagaon-medical-college,Government,Assam,,100,,,,False,MBBS,,,,#15803d,,,,,,,,,,,,,,,,,
"Nalanda Medical College, Patna",nalanda-medical-college-patna,Government,Bihar,Patna,150,,,,False,MBBS,,,,#15803d,,,,,,,,,,,,,,,,,
"Nalbari Medical College and Hospital, Assam",nalbari-medical-college-and-hospital-assam,Government,Assam,Assam,100,,,,False,MBBS,,,,#15803d,,,,,,,,,,,,,,,,,
"Netaji Subhash Chandra Bose Medical College, Jabalpur",netaji-subhash-chandra-bose-medical-college-jabalpur,Government,Madhya Pradesh,Jabalpur,250,,,,False,MBBS,,,,#15803d,,,,,,,,,,,,,,,,,
"Nilratan Sircar Medical College, Kolkata",nilratan-sircar-medical-college-kolkata,Government,West Bengal,Kolkata,250,,,,False,MBBS,,,,#15803d,,,,,,,,,,,,,,,,,
"North Bengal Medical College, Darjeeling",north-bengal-medical-college-darjeeling,Government,West Bengal,Darjeeling,200,,,,False,MBBS,,,,#15803d,,,,,,,,,,,,,,,,,
"North Delhi Muncipal Corporation Medical College, Delhi",north-delhi-muncipal-corporation-medical-college-delhi,Government,Delhi,Delhi,60,,,,False,MBBS,,,,#15803d,,,,,,,,,,,,,,,,,
"North Eastern Indira Gandhi Regional Instt. of Health and Medical Sciences, Shil",north-eastern-indira-gandhi-regional-instt-of-health-and-medical-sciences-shil,Government,Meghalaya,Shil,50,,,,False,MBBS,,,,#15803d,,,,,,,,,,,,,,,,,
"Osmania Medical College, Hyderabad",osmania-medical-college-hyderabad,Government,Telangana,Hyderabad,250,,,,False,MBBS,,,,#15803d,,,,,,,,,,,,,,,,,
"PABITRA MOHAN PRADHAN MEDICAL COLLEGE, TALCHER",pabitra-mohan-pradhan-medical-college-talcher,Government,Odisha,TALCHER,100,,,,False,MBBS,,,,#15803d,,,,,,,,,,,,,,,,,
"PT NEKI RAM SHARMA GOVERNMENT MEDICAL COLLEGE, BHIWANI",pt-neki-ram-sharma-government-medical-college-bhiwani,Government,Haryana,BHIWANI,100,,,,False,MBBS,,,,#15803d,,,,,,,,,,,,,,,,,
"Pandit deendayal Upadhyay Medical College, Rajkot",pandit-deendayal-upadhyay-medical-college-rajkot,Government,Gujarat,Rajkot,200,,,,False,MBBS,,,,#15803d,,,,,,,,,,,,,,,,,
"Patliputra Medical College, Dhanbad",patliputra-medical-college-dhanbad,Government,Jharkhand,Dhanbad,100,,,,False,MBBS,,,,#15803d,,,,,,,,,,,,,,,,,
"Patna Medical College, Patna",patna-medical-college-patna,Government,Bihar,Patna,200,,,,False,MBBS,,,,#15803d,,,,,,,,,,,,,,,,,
Prafulla Chandra Sen Government Medical College and Hospital,prafulla-chandra-sen-government-medical-college-and-hospital,Government,West Bengal,,100,,,,False,MBBS,,,,#15803d,,,,,,,,,,,,,,,,,
Pragjyotishpur Medical College,pragjyotishpur-medical-college,Government,Assam,,100,,,,False,MBBS,,,,#15803d,,,,,,,,,,,,,,,,,
"Pt B D Sharma Post Graduate Institute of Medical Sciences, Rohtak",pt-b-d-sharma-post-graduate-institute-of-medical-sciences-rohtak,Government,Haryana,Rohtak,250,,,,False,MBBS,,,,#15803d,,,,,,,,,,,,,,,,,
"Pt. J N M Medical College, Raipur",pt-j-n-m-medical-college-raipur,Government,Chattisgarh,Raipur,230,,,,False,MBBS,,,,#15803d,,,,,,,,,,,,,,,,,
"Pt. Jawahar Lal Nehru Government Medical College, Chamba",pt-jawahar-lal-nehru-government-medical-college-chamba,Government,Himachal Pradesh,Chamba,120,,,,False,MBBS,,,,#15803d,,,,,,,,,,,,,,,,,
"Pt. Raghunath Murmu Medical College and Hospital, Baripada, Odisha",pt-raghunath-murmu-medical-college-and-hospital-baripada-odisha,Government,Odisha,Odisha,125,,,,False,MBBS,,,,#15803d,,,,,,,,,,,,,,,,,
Purulia Government Medical College & Hospital,purulia-government-medical-college-hospital,Government,West Bengal,,150,,,,False,MBBS,,,,#15803d,,,,,,,,,,,,,,,,,
"R N T Medical College,  Udaipur",r-n-t-medical-college-udaipur,Government,Rajasthan,Udaipur,250,,,,False,MBBS,,,,#15803d,,,,,,,,,,,,,,,,,
"RANGARAYA MEDICAL COLLEGE, KAKINADA",rangaraya-medical-college-kakinada,Government,Andhra Pradesh,KAKINADA,250,,,,False,MBBS,,,,#15803d,,,,,,,,,,,,,,,,,
"RG Kar Medical College, Kolkata",rg-kar-medical-college-kolkata,Government,West Bengal,Kolkata,249,,,,False,MBBS,,,,#15803d,,,,,,,,,,,,,,,,,
"RUHS College of Medical Sciences, Jaipur",ruhs-college-of-medical-sciences-jaipur,Government,Rajasthan,Jaipur,150,,,,False,MBBS,,,,#15803d,,,,,,,,,,,,,,,,,
"Raichur Institute Of Medical Science, Raichur",raichur-institute-of-medical-science-raichur,Government,Karnataka,Raichur,200,,,,False,MBBS,,,,#15803d,,,,,,,,,,,,,,,,,
"Raiganj Government Medical College & Hospital, Raiganj",raiganj-government-medical-college-hospital-raiganj,Government,West Bengal,Raiganj,150,,,,False,MBBS,,,,#15803d,,,,,,,,,,,,,,,,,
"Rajah Muthiah Medical College, Annamalainagar",rajah-muthiah-medical-college-annamalainagar,Government,Tamil Nadu,Annamalainagar,150,,,,False,MBBS,,,,#15803d,,,,,,,,,,,,,,,,,
"Rajashree Chatrapati Shahu Maharaj Government Medical College, Kolhapur",rajashree-chatrapati-shahu-maharaj-government-medical-college-kolhapur,Government,Maharashtra,Kolhapur,150,,,,False,MBBS,,,,#15803d,,,,,,,,,,,,,,,,,
"Rajendra Institute of Medical Sciences, Ranchi",rajendra-institute-of-medical-sciences-ranchi,Government,Jharkhand,Ranchi,180,,,,False,MBBS,,,,#15803d,,,,,,,,,,,,,,,,,
"Rajiv Gandhi Institute of Medical Sciences, adilabad",rajiv-gandhi-institute-of-medical-sciences-adilabad,Government,Telangana,adilabad,120,,,,False,MBBS,,,,#15803d,,,,,,,,,,,,,,,,,
"Rajiv Gandhi Medical College and Chhatrapati Shivaji Maharaj Hospital, Thane",rajiv-gandhi-medical-college-and-chhatrapati-shivaji-maharaj-hospital-thane,Government,Maharashtra,Thane,100,,,,False,MBBS,,,,#15803d,,,,,,,,,,,,,,,,,
"Rajkiya Allopathic Medical College, Bahraich, UP",rajkiya-allopathic-medical-college-bahraich-up,Government,Uttar Pradesh,UP,100,,,,False,MBBS,,,,#15803d,,,,,,,,,,,,,,,,,
"Rajkiya Medical College Jalaun, Orai, Uttar Pradesh",rajkiya-medical-college-jalaun-orai-uttar-pradesh,Government,Uttar Pradesh,Uttar Pradesh,100,,,,False,MBBS,,,,#15803d,,,,,,,,,,,,,,,,,
"Rampurhat Government Medical College & Hospital, Rampurhat",rampurhat-government-medical-college-hospital-rampurhat,Government,West Bengal,Rampurhat,150,,,,False,MBBS,,,,#15803d,,,,,,,,,,,,,,,,,
Regional Institute of Medical Sciences,regional-institute-of-medical-sciences,Government,Manipur,,125,,,,False,MBBS,,,,#15803d,,,,,,,,,,,,,,,,,
"S N Medical College, Agra",s-n-medical-college-agra,Government,Uttar Pradesh,Agra,200,,,,False,MBBS,,,,#15803d,,,,,,,,,,,,,,,,,
"S V Medical College, Tirupati",s-v-medical-college-tirupati,Government,Andhra Pradesh,Tirupati,240,,,,False,MBBS,,,,#15803d,,,,,,,,,,,,,,,,,
"SCB Medical College, Cuttack",scb-medical-college-cuttack,Government,Odisha,Cuttack,250,,,,False,MBBS,,,,#15803d,,,,,,,,,,,,,,,,,
"SMS Medical College, Jaipur",sms-medical-college-jaipur,Government,Rajasthan,Jaipur,250,,,,False,MBBS,,,,#15803d,,,,,,,,,,,,,,,,,
"SRTR Medical College, Ambajogai",srtr-medical-college-ambajogai,Government,Maharashtra,Ambajogai,150,,,,False,MBBS,,,,#15803d,,,,,,,,,,,,,,,,,
"SVIMS-SRI PADMAVATHI MEDICAL COLLEGE FOR WOMEN, SVIMS CAMPUS, ALIPIRI ROAD, TIRU",svims-sri-padmavathi-medical-college-for-women-svims-campus-alipiri-road-tiru,Government,Andhra Pradesh,TIRU,175,,,,False,MBBS,,,,#15803d,,,,,,,,,,,,,,,,,
"Saheed Laxman Nayak Medical College & Hospital, Koraput",saheed-laxman-nayak-medical-college-hospital-koraput,Government,Odisha,Koraput,125,,,,False,MBBS,,,,#15803d,,,,,,,,,,,,,,,,,
"Saheed Rendo Majhi Medical College and Hospital, Bhawanipatna, Kalahandi, Odisha",saheed-rendo-majhi-medical-college-and-hospital-bhawanipatna-kalahandi-odisha,Government,Odisha,Odisha,100,,,,False,MBBS,,,,#15803d,,,,,,,,,,,,,,,,,
"Sarat Chandra Chattopadhyay Government Medical College & Hospital, Uluberia",sarat-chandra-chattopadhyay-government-medical-college-hospital-uluberia,Government,West Bengal,Uluberia,100,,,,False,MBBS,,,,#15803d,,,,,,,,,,,,,,,,,
"Sardar Patel Medical College, Bikaner",sardar-patel-medical-college-bikaner,Government,Rajasthan,Bikaner,250,,,,False,MBBS,,,,#15803d,,,,,,,,,,,,,,,,,
"Shaheed Hasan Khan Mewati Government Medical College, Nalhar",shaheed-hasan-khan-mewati-government-medical-college-nalhar,Government,Haryana,Nalhar,120,,,,False,MBBS,,,,#15803d,,,,,,,,,,,,,,,,,
"Shaikh-UL-Hind Maulana Mahmood Hasan Medical College, Saharanpur",shaikh-ul-hind-maulana-mahmood-hasan-medical-college-saharanpur,Government,Uttar Pradesh,Saharanpur,100,,,,False,MBBS,,,,#15803d,,,,,,,,,,,,,,,,,
"Sher-I-Kashmir Instt. Of Medical Sciences, Srinagar",sher-i-kashmir-instt-of-medical-sciences-srinagar,Government,Jammu & Kashmir,Srinagar,125,,,,False,MBBS,,,,#15803d,,,,,,,,,,,,,,,,,
Shillong Medical College,shillong-medical-college,Government,Meghalaya,,50,,,,False,MBBS,,,,#15803d,,,,,,,,,,,,,,,,,
"Shimoga Institute of Medical Sciences, Shimoga",shimoga-institute-of-medical-sciences-shimoga,Government,Karnataka,Shimoga,150,,,,False,MBBS,,,,#15803d,,,,,,,,,,,,,,,,,
"Shri Atal Bihari Vajapayee Medical College and Research Institute, Bengaluru,",shri-atal-bihari-vajapayee-medical-college-and-research-institute-bengaluru,Government,Karnataka,,200,,,,False,MBBS,,,,#15803d,,,,,,,,,,,,,,,,,
"Shri Atal Bihari Vajpayee Government Medical College, Faridabad",shri-atal-bihari-vajpayee-government-medical-college-faridabad,Government,Haryana,Faridabad,100,,,,False,MBBS,,,,#15803d,,,,,,,,,,,,,,,,,
"Shri Kalyan Govt. Medical College, Sikar, Rajasthan",shri-kalyan-govt-medical-college-sikar-rajasthan,Government,Rajasthan,Rajasthan,100,,,,False,MBBS,,,,#15803d,,,,,,,,,,,,,,,,,
"Shri Krishna Medical College, Muzzafarpur",shri-krishna-medical-college-muzzafarpur,Government,Bihar,Muzzafarpur,120,,,,False,MBBS,,,,#15803d,,,,,,,,,,,,,,,,,
"Shri Lal Bahadur Shastri Government Medical College, Mandi, HP",shri-lal-bahadur-shastri-government-medical-college-mandi-hp,Government,Himachal Pradesh,HP,120,,,,False,MBBS,,,,#15803d,,,,,,,,,,,,,,,,,
"Shri Vasant Rao Naik Govt. Medical College, Yavatmal",shri-vasant-rao-naik-govt-medical-college-yavatmal,Government,Maharashtra,Yavatmal,200,,,,False,MBBS,,,,#15803d,,,,,,,,,,,,,,,,,
"Shyam Shah Medical College, Rewa",shyam-shah-medical-college-rewa,Government,Madhya Pradesh,Rewa,150,,,,False,MBBS,,,,#15803d,,,,,,,,,,,,,,,,,
"Silchar Medical College, Silchar",silchar-medical-college-silchar,Government,Assam,Silchar,150,,,,False,MBBS,,,,#15803d,,,,,,,,,,,,,,,,,
"Soban Singh jeena Government institute of Medical science & Research, Almora",soban-singh-jeena-government-institute-of-medical-science-research-almora,Government,Uttarakhand,Almora,100,,,,False,MBBS,,,,#15803d,,,,,,,,,,,,,,,,,
"Sri Bhausaheb Hire Government Medical College, Dhule",sri-bhausaheb-hire-government-medical-college-dhule,Government,Maharashtra,Dhule,150,,,,False,MBBS,,,,#15803d,,,,,,,,,,,,,,,,,
"Sri Jagannath Medical College & Hospital, Puri",sri-jagannath-medical-college-hospital-puri,Government,Odisha,Puri,100,,,,False,MBBS,,,,#15803d,,,,,,,,,,,,,,,,,
"Stanley Medical College, Chennai",stanley-medical-college-chennai,Government,Tamil Nadu,Chennai,250,,,,False,MBBS,,,,#15803d,,,,,,,,,,,,,,,,,
"Sunderlal Patwa Government Medical College, Mandsaur",sunderlal-patwa-government-medical-college-mandsaur,Government,Madhya Pradesh,Mandsaur,100,,,,False,MBBS,,,,#15803d,,,,,,,,,,,,,,,,,
"T D Medical College, Alleppey (Allappuzha)",t-d-medical-college-alleppey-allappuzha,Government,Kerala,Alleppey (Allappuzha),175,,,,False,MBBS,,,,#15803d,,,,,,,,,,,,,,,,,
Tamralipto Government Medical College & Hospital,tamralipto-government-medical-college-hospital,Government,West Bengal,,100,,,,False,MBBS,,,,#15803d,,,,,,,,,,,,,,,,,
Tezpur Medical College,tezpur-medical-college,Government,Assam,,125,,,,False,MBBS,,,,#15803d,,,,,,,,,,,,,,,,,
"Thanjavur Medical College,Thanjavur",thanjavur-medical-college-thanjavur,Government,Tamil Nadu,Thanjavur,150,,,,False,MBBS,,,,#15803d,,,,,,,,,,,,,,,,,
"Theni Government Medical College,Theni",theni-government-medical-college-theni,Government,Tamil Nadu,Theni,100,,,,False,MBBS,,,,#15803d,,,,,,,,,,,,,,,,,
"Thiruvarur Govt. Medical College, Thiruvarur",thiruvarur-govt-medical-college-thiruvarur,Government,Tamil Nadu,Thiruvarur,100,,,,False,MBBS,,,,#15803d,,,,,,,,,,,,,,,,,
"Thoothukudi Medical College, Thoothukudi",thoothukudi-medical-college-thoothukudi,Government,Tamil Nadu,Thoothukudi,150,,,,False,MBBS,,,,#15803d,,,,,,,,,,,,,,,,,
Tinsukia Medical College,tinsukia-medical-college,Government,Assam,,100,,,,False,MBBS,,,,#15803d,,,,,,,,,,,,,,,,,
"Tirunelveli Medical College,Tirunelveli",tirunelveli-medical-college-tirunelveli,Government,Tamil Nadu,Tirunelveli,250,,,,False,MBBS,,,,#15803d,,,,,,,,,,,,,,,,,
"Tomo Riba Institute of Health & Medical Sciences, Naharlagun",tomo-riba-institute-of-health-medical-sciences-naharlagun,Government,Arunachal Pradesh,Naharlagun,100,,,,False,MBBS,,,,#15803d,,,,,,,,,,,,,,,,,
"Topiwala National Medical College, Mumbai",topiwala-national-medical-college-mumbai,Government,Maharashtra,Mumbai,150,,,,False,MBBS,,,,#15803d,,,,,,,,,,,,,,,,,
Uma Nath Singh Autonomous State Medical College Society Jaunpur,uma-nath-singh-autonomous-state-medical-college-society-jaunpur,Government,Uttar Pradesh,,100,,,,False,MBBS,,,,#15803d,,,,,,,,,,,,,,,,,
"University College of Medical Sciences & GTB Hospital, New Delhi",university-college-of-medical-sciences-gtb-hospital-new-delhi,Government,Delhi,New Delhi,169,,,,False,MBBS,,,,#15803d,,,,,,,,,,,,,,,,,
"Uttar Pradesh University of Medical Sciences, (Prev. UP Rural Inst.of Med.Sc&R)",uttar-pradesh-university-of-medical-sciences-prev-up-rural-inst-of-med-sc-r,Government,Uttar Pradesh,(Prev. UP Rural Inst.of Med.Sc&R),200,,,,False,MBBS,,,,#15803d,,,,,,,,,,,,,,,,,
Vardhaman Mahavir Medical College and Safdarjung Hospital,vardhaman-mahavir-medical-college-and-safdarjung-hospital,Government,Delhi,,170,,,,False,MBBS,,,,#15803d,,,,,,,,,,,,,,,,,
"Veer Chandra Singh Garhwali Govt. Medical Sc. & Research Instt, Srinagar, Pauri",veer-chandra-singh-garhwali-govt-medical-sc-research-instt-srinagar-pauri,Government,Uttarakhand,Pauri,150,,,,False,MBBS,,,,#15803d,,,,,,,,,,,,,,,,,
"Veer Surendra Sai Institute of Medical Sciences and Research, Burla",veer-surendra-sai-institute-of-medical-sciences-and-research-burla,Government,Odisha,Burla,200,,,,False,MBBS,,,,#15803d,,,,,,,,,,,,,,,,,
"Vijaynagar Institute of Medical Sciences, Bellary",vijaynagar-institute-of-medical-sciences-bellary,Government,Karnataka,Bellary,250,,,,False,MBBS,,,,#15803d,,,,,,,,,,,,,,,,,
Virendra Kumar Sakhlecha Government Medical College,virendra-kumar-sakhlecha-government-medical-college,Government,Madhya Pradesh,,100,,,,False,MBBS,,,,#15803d,,,,,,,,,,,,,,,,,
YADGIRI INSTITUTE OF MEDICAL SCIENCES,yadgiri-institute-of-medical-sciences,Government,Karnataka,,150,,,,False,MBBS,,,,#15803d,,,,,,,,,,,,,,,,,
ZORAM MEDICAL COLLEGE,zoram-medical-college,Government,Mizoram,,100,,,,False,MBBS,,,,#15803d,,,,,,,,,,,,,,,,,
"government medical college,wanaparthy",government-medical-college-wanaparthy,Government,Telangana,wanaparthy,150,,,,False,MBBS,,,,#15803d,,,,,,,,,,,,,,,,,
GMERS MEDICAL COLLEGE GANDHINAGAR,gmers-medical-college-gandhinagar,Govt. Society,Gujarat,,200,,,,False,MBBS,,,,#15803d,,,,,,,,,,,,,,,,,
GMERS MEDICAL COLLEGE GOTRI VADODARA,gmers-medical-college-gotri-vadodara,Govt. Society,Gujarat,,200,,,,False,MBBS,,,,#15803d,,,,,,,,,,,,,,,,,
"GMERS MEDICAL COLLEGE, VALSAD",gmers-medical-college-valsad,Govt. Society,Gujarat,VALSAD,200,,,,False,MBBS,,,,#15803d,,,,,,,,,,,,,,,,,
"GMERS Medical College, Dharpur Patan",gmers-medical-college-dharpur-patan,Govt. Society,Gujarat,Dharpur Patan,200,,,,False,MBBS,,,,#15803d,,,,,,,,,,,,,,,,,
"GMERS Medical College, Hadiyol, Himmatnagar",gmers-medical-college-hadiyol-himmatnagar,Govt. Society,Gujarat,Himmatnagar,200,,,,False,MBBS,,,,#15803d,,,,,,,,,,,,,,,,,
"GMERS Medical College, Junagadh",gmers-medical-college-junagadh,Govt. Society,Gujarat,Junagadh,200,,,,False,MBBS,,,,#15803d,,,,,,,,,,,,,,,,,
"GMERS Medical College, Sola, Ahmedabad",gmers-medical-college-sola-ahmedabad,Govt. Society,Gujarat,Ahmedabad,200,,,,False,MBBS,,,,#15803d,,,,,,,,,,,,,,,,,
"GMERS Medical College, Vadnagar, Mehsana",gmers-medical-college-vadnagar-mehsana,Govt. Society,Gujarat,Mehsana,200,,,,False,MBBS,,,,#15803d,,,,,,,,,,,,,,,,,
